{"$id":"https://surfaces.dev/schemas/surfaceops-designer-review-ui/surfaceops-designer-review-workbench.v0.schema.json","$schema":"https://json-schema.org/draft/2020-12/schema","additionalProperties":false,"properties":{"authority":{"additionalProperties":false,"properties":{"kanbanCardsOwnsCollaborationState":{"const":true},"kanbanLaneMovementCommitsDecision":{"const":false},"productionAdapterImplemented":{"const":false},"surfaceOpsOwnsReviewDecision":{"const":true},"surfacesEvidenceRemainsProofAuthority":{"const":true}},"required":["surfaceOpsOwnsReviewDecision","kanbanCardsOwnsCollaborationState","kanbanLaneMovementCommitsDecision","surfacesEvidenceRemainsProofAuthority","productionAdapterImplemented"],"type":"object"},"dag":{"additionalProperties":false,"properties":{"edges":{"items":{"additionalProperties":true,"type":"object"},"minItems":3,"type":"array"},"nodes":{"items":{"additionalProperties":true,"type":"object"},"minItems":4,"type":"array"}},"required":["nodes","edges"],"type":"object"},"decisionPanel":{"additionalProperties":true,"type":"object"},"diagnostics":{"items":{"additionalProperties":false,"properties":{"artifactPath":{"type":"string"},"canonicalMessage":{"type":"string"},"code":{"type":"string"},"fixtureCoverage":{"type":"string"},"jsonPointer":{"type":"string"},"message":{"type":"string"},"phase":{"type":"string"},"promotionStatus":{"enum":["allowed","blocked","review_required"]},"severity":{"enum":["error","warning","review"]},"sourceRef":{"type":["string","null"]},"stage":{"type":"string"},"suggestedAction":{"type":"string"},"trigger":{"type":"string"},"validationResult":{"enum":["valid","invalid","review_required"]}},"required":["code","trigger","canonicalMessage","message","severity","stage","phase","validationResult","promotionStatus","artifactPath","jsonPointer","sourceRef","fixtureCoverage","suggestedAction"],"type":"object"},"type":"array"},"diagnosticsRegistry":{"items":{"additionalProperties":false,"properties":{"artifactPath":{"type":"string"},"canonicalMessage":{"type":"string"},"code":{"type":"string"},"fixtureCoverage":{"type":"string"},"jsonPointer":{"type":"string"},"message":{"type":"string"},"phase":{"type":"string"},"promotionStatus":{"enum":["allowed","blocked","review_required"]},"severity":{"enum":["error","warning","review"]},"sourceRef":{"type":["string","null"]},"stage":{"type":"string"},"suggestedAction":{"type":"string"},"trigger":{"type":"string"},"validationResult":{"enum":["valid","invalid","review_required"]}},"required":["code","trigger","canonicalMessage","message","severity","stage","phase","validationResult","promotionStatus","artifactPath","jsonPointer","sourceRef","fixtureCoverage","suggestedAction"],"type":"object"},"type":"array"},"evidenceRefs":{"items":{"additionalProperties":false,"properties":{"hash":{"pattern":"^[0-9a-f]{64}$","type":["string","null"]},"hashAlgorithm":{"const":"sha256"},"path":{"type":"string"},"schemaId":{"type":"string"},"sourceRef":{"type":["string","null"]}},"required":["path","schemaId","hashAlgorithm","hash","sourceRef"],"type":"object"},"minItems":1,"type":"array"},"inspector":{"additionalProperties":true,"type":"object"},"kanbanMirror":{"additionalProperties":true,"type":"object"},"provenance":{"additionalProperties":false,"properties":{"generatedAt":{"const":"1970-01-01T00:00:00.000Z"},"generator":{"type":"string"},"sourceRefs":{"items":{"type":"string"},"type":"array"}},"required":["generatedAt","generator","sourceRefs"],"type":"object"},"scenarioId":{"const":"button-variants-live-review"},"schemaId":{"const":"surfaceops-designer-review-workbench.v0"},"targetSelectionRef":{"additionalProperties":false,"properties":{"hash":{"pattern":"^[0-9a-f]{64}$","type":["string","null"]},"hashAlgorithm":{"const":"sha256"},"path":{"type":"string"},"schemaId":{"type":"string"},"sourceRef":{"type":["string","null"]}},"required":["path","schemaId","hashAlgorithm","hash","sourceRef"],"type":"object"},"version":{"const":"0.0.0"},"workItem":{"additionalProperties":true,"type":"object"}},"required":["schemaId","version","scenarioId","targetSelectionRef","workItem","dag","inspector","decisionPanel","kanbanMirror","authority","evidenceRefs","diagnostics","diagnosticsRegistry","provenance"],"type":"object"}