{"authority":{"kanbanCardsOwnsCollaborationState":true,"kanbanLaneMovementCommitsDecision":false,"productionAdapterImplemented":false,"surfaceOpsOwnsReviewDecision":true,"surfacesEvidenceRemainsProofAuthority":true},"dag":{"edges":[{"from":"kanban-card","label":"evidence marker opens review workbench","to":"surfaceops-intake"},{"from":"surfaceops-intake","label":"review item is bound to accepted evidence refs","to":"authority-trace"},{"from":"authority-trace","label":"DAG node selection drives inspector context","to":"inspector"},{"from":"inspector","label":"designer records structured receipt","to":"decision-receipt"},{"from":"decision-receipt","label":"receipt summary mirrors back to kanban.cards","to":"kanban-mirror"}],"nodes":[{"label":"kanban.cards card","nodeId":"kanban-card","role":"collaboration-signal","status":"needs review"},{"label":"SurfaceOps intake","nodeId":"surfaceops-intake","role":"evidence-binding","status":"bound"},{"label":"SurfaceOps DAG","nodeId":"authority-trace","role":"authority-routing","status":"ready"},{"label":"Designer inspector","nodeId":"inspector","role":"visual-review","status":"selected"},{"label":"Decision receipt","nodeId":"decision-receipt","role":"structured-decision","status":"pending"},{"label":"Mirrored card update","nodeId":"kanban-mirror","role":"collaboration-mirror","status":"planned"}]},"decisionPanel":{"allowedActions":["approve for handoff","request refinement","block"],"blockedWhenEvidenceMissing":true,"controlsEnabled":true,"defaultAction":"approve for handoff","oneReceiptPerReviewItemAndEvidenceHash":true,"rationaleRequired":true},"diagnostics":[],"diagnosticsRegistry":[{"artifactPath":"fixtures/surfaceops-designer-review-ui/mutations/missing-upstream-evidence.surfaceops-designer-review-ui.json","canonicalMessage":"Required designer review UI upstream evidence is missing.","code":"SURFACEOPS_DESIGNER_REVIEW_UPSTREAM_MISSING","fixtureCoverage":"mutations/missing-upstream-evidence.surfaceops-designer-review-ui.json","jsonPointer":"/upstreamRefs","message":"Required designer review UI upstream evidence is missing.","phase":"surfaceops-designer-review-ui","promotionStatus":"blocked","severity":"error","sourceRef":null,"stage":"preflight","suggestedAction":"Regenerate accepted designer workflow, P4, and kanban-live evidence before continuing.","trigger":"Required designer review UI upstream evidence is missing.","validationResult":"invalid"},{"artifactPath":"fixtures/surfaceops-designer-review-ui/mutations/upstream-hash-mismatch.surfaceops-designer-review-ui.json","canonicalMessage":"Designer review UI upstream hash does not match the accepted boundary.","code":"SURFACEOPS_DESIGNER_REVIEW_UPSTREAM_HASH_MISMATCH","fixtureCoverage":"mutations/upstream-hash-mismatch.surfaceops-designer-review-ui.json","jsonPointer":"/upstreamRefs","message":"Designer review UI upstream hash does not match the accepted boundary.","phase":"surfaceops-designer-review-ui","promotionStatus":"blocked","severity":"error","sourceRef":null,"stage":"preflight","suggestedAction":"Regenerate accepted designer workflow, P4, and kanban-live evidence before continuing.","trigger":"Designer review UI upstream hash does not match the accepted boundary.","validationResult":"invalid"},{"artifactPath":"fixtures/surfaceops-designer-review-ui/invalid/target-undeclared.surfaceops-designer-review-ui.json","canonicalMessage":"SurfaceOps designer review UI target is not declared.","code":"SURFACEOPS_DESIGNER_REVIEW_TARGET_UNDECLARED","fixtureCoverage":"invalid/target-undeclared.surfaceops-designer-review-ui.json","jsonPointer":"/targetId","message":"SurfaceOps designer review UI target is not declared.","phase":"surfaceops-designer-review-ui","promotionStatus":"blocked","severity":"error","sourceRef":null,"stage":"target-selection","suggestedAction":"Keep SurfaceOps review authority explicit and regenerate designer review UI evidence.","trigger":"SurfaceOps designer review UI target is not declared.","validationResult":"invalid"},{"artifactPath":"fixtures/surfaceops-designer-review-ui/invalid/missing-evidence-ref.surfaceops-designer-review-ui.json","canonicalMessage":"Designer review UI requires exact evidence refs before decisions are enabled.","code":"SURFACEOPS_DESIGNER_REVIEW_EVIDENCE_REF_MISSING","fixtureCoverage":"invalid/missing-evidence-ref.surfaceops-designer-review-ui.json","jsonPointer":"/evidenceRefs","message":"Designer review UI requires exact evidence refs before decisions are enabled.","phase":"surfaceops-designer-review-ui","promotionStatus":"blocked","severity":"error","sourceRef":null,"stage":"workbench","suggestedAction":"Keep SurfaceOps review authority explicit and regenerate designer review UI evidence.","trigger":"Designer review UI requires exact evidence refs before decisions are enabled.","validationResult":"invalid"},{"artifactPath":"fixtures/surfaceops-designer-review-ui/invalid/authority-override.surfaceops-designer-review-ui.json","canonicalMessage":"Designer review UI must not let kanban.cards override SurfaceOps decisions.","code":"SURFACEOPS_DESIGNER_REVIEW_AUTHORITY_OVERRIDE","fixtureCoverage":"invalid/authority-override.surfaceops-designer-review-ui.json","jsonPointer":"/authority","message":"Designer review UI must not let kanban.cards override SurfaceOps decisions.","phase":"surfaceops-designer-review-ui","promotionStatus":"blocked","severity":"error","sourceRef":null,"stage":"authority","suggestedAction":"Keep SurfaceOps review authority explicit and regenerate designer review UI evidence.","trigger":"Designer review UI must not let kanban.cards override SurfaceOps decisions.","validationResult":"invalid"},{"artifactPath":"fixtures/surfaceops-designer-review-ui/invalid/hidden-decision.surfaceops-designer-review-ui.json","canonicalMessage":"Designer review UI decisions must be visible in the receipt and evidence refs.","code":"SURFACEOPS_DESIGNER_REVIEW_HIDDEN_DECISION","fixtureCoverage":"invalid/hidden-decision.surfaceops-designer-review-ui.json","jsonPointer":"/decision","message":"Designer review UI decisions must be visible in the receipt and evidence refs.","phase":"surfaceops-designer-review-ui","promotionStatus":"blocked","severity":"error","sourceRef":null,"stage":"decision","suggestedAction":"Keep SurfaceOps review authority explicit and regenerate designer review UI evidence.","trigger":"Designer review UI decisions must be visible in the receipt and evidence refs.","validationResult":"invalid"},{"artifactPath":"fixtures/surfaceops-designer-review-ui/invalid/mirror-status-override.surfaceops-designer-review-ui.json","canonicalMessage":"Mirrored kanban status must be derived from the SurfaceOps decision receipt.","code":"SURFACEOPS_DESIGNER_REVIEW_MIRROR_STATUS_INVALID","fixtureCoverage":"invalid/mirror-status-override.surfaceops-designer-review-ui.json","jsonPointer":"/mirroredStatus","message":"Mirrored kanban status must be derived from the SurfaceOps decision receipt.","phase":"surfaceops-designer-review-ui","promotionStatus":"blocked","severity":"error","sourceRef":null,"stage":"mirror","suggestedAction":"Mirror only the structured SurfaceOps decision receipt back to kanban.cards.","trigger":"Mirrored kanban status must be derived from the SurfaceOps decision receipt.","validationResult":"invalid"},{"artifactPath":"fixtures/surfaceops-designer-review-ui/invalid/production-adapter-claim.surfaceops-designer-review-ui.json","canonicalMessage":"Production adapter behavior is outside the designer review UI proof.","code":"SURFACEOPS_DESIGNER_REVIEW_PRODUCTION_ADAPTER_FORBIDDEN","fixtureCoverage":"invalid/production-adapter-claim.surfaceops-designer-review-ui.json","jsonPointer":"/claims","message":"Production adapter behavior is outside the designer review UI proof.","phase":"surfaceops-designer-review-ui","promotionStatus":"blocked","severity":"error","sourceRef":null,"stage":"boundary","suggestedAction":"Keep production auth, hosted persistence, webhooks, and production sync in the later adapter proof.","trigger":"Production adapter behavior is outside the designer review UI proof.","validationResult":"invalid"},{"artifactPath":"fixtures/surfaceops-designer-review-ui/review/live-kanban-required.surfaceops-designer-review-ui.json","canonicalMessage":"Designer review UI needs the local live kanban adapter evidence before browser proof.","code":"SURFACEOPS_DESIGNER_REVIEW_LIVE_KANBAN_REQUIRED","fixtureCoverage":"review/live-kanban-required.surfaceops-designer-review-ui.json","jsonPointer":"/kanbanMirror","message":"Designer review UI needs the local live kanban adapter evidence before browser proof.","phase":"surfaceops-designer-review-ui","promotionStatus":"review_required","severity":"review","sourceRef":null,"stage":"live-boundary","suggestedAction":"Run the local-live kanban proof and browser proof before claiming the designer review UI loop.","trigger":"Designer review UI needs the local live kanban adapter evidence before browser proof.","validationResult":"review_required"},{"artifactPath":"fixtures/surfaceops-designer-review-ui/mutations/hash-mismatch.surfaceops-designer-review-ui-evidence.json","canonicalMessage":"Designer review UI evidence hash does not match the evidence manifest.","code":"SURFACEOPS_DESIGNER_REVIEW_EVIDENCE_HASH_MISMATCH","fixtureCoverage":"mutations/hash-mismatch.surfaceops-designer-review-ui-evidence.json","jsonPointer":"/artifacts","message":"Designer review UI evidence hash does not match the evidence manifest.","phase":"surfaceops-designer-review-ui","promotionStatus":"blocked","severity":"error","sourceRef":null,"stage":"evidence","suggestedAction":"Keep SurfaceOps review authority explicit and regenerate designer review UI evidence.","trigger":"Designer review UI evidence hash does not match the evidence manifest.","validationResult":"invalid"}],"evidenceRefs":[{"hash":"c02c0d48ed5c60fd67fb7921783b89a058642425032f159513fc35629e3a7e52","hashAlgorithm":"sha256","path":"artifacts/designer-workflow-trace/evidence.json","schemaId